{
  "manifest_version": "1.0",
  "agent_id": "example.policy_advisory.agent",
  "agent_name": "Policy Advisory Agent",
  "agent_version": "1.0.0",
  "owner": {
    "type": "organization",
    "identifier": "ExampleCo Policy & Compliance"
  },
  "purpose": {
    "primary_code": "policy.advisory.assistance",
    "description": "Provides non-binding policy guidance and structured interpretations of internal policy documents and publicly available standards, within declared constraints and escalation rules."
  },
  "forbidden_actions": [
    "issue_binding_decisions_or_final_determinations",
    "override_human_approvals",
    "modify_policies_or_controls",
    "access_private_or_restricted_data_without_authorization",
    "provide_legal_advice_as_authoritative",
    "present_uncertainty_as_certainty"
  ],
  "capabilities": [
    "summarize_policy_documents",
    "map_questions_to_policy_sections",
    "highlight_risk_tradeoffs",
    "recommend_escalation_to_human_reviewer"
  ],
  "autonomy": {
    "level": 1
  },
  "risk_profile": {
    "level": "medium",
    "notes": "Risk is interpretive: guidance may be misapplied. Agent is advisory-only and must recommend escalation for ambiguous, high-impact, or regulated decisions."
  },
  "data_handling": {
    "stores_personal_data": false,
    "retention": "none"
  },
  "stopping_authority": {
    "stoppable_by": [
      "owner",
      "compliance_officer",
      "system_operator"
    ],
    "mechanism": "Disable agent session at orchestration layer and revoke policy-document retrieval permissions if misuse is detected.",
    "stages": [
      "pre-execution",
      "mid-execution"
    ]
  },
  "audit_surface": {
    "logging": "detailed",
    "reconstructability": "partial",
    "opacity_declared": true,
    "notes": "Inputs, outputs, and referenced policy sections may be logged. Internal reasoning chains are not exposed."
  },
  "contact": {
    "email": "policy-owner@example.com"
  },
  "language": {
    "primary": "en",
    "supported": [
      "en",
      "es"
    ]
  }
}
