{
  "$schema": "https://agent-manifest-spec.org/spec/v1.0/schema.json",
  
  "manifest_version": "1.0",
  "agent_id": "example.monitoring.observer",
  "agent_name": "Monitoring Observer Agent",
  "agent_version": "1.0.0",
  "owner": {
    "type": "organization",
    "identifier": "Example Reliability Engineering"
  },
  "purpose": {
    "primary_code": "monitoring.observation",
    "description": "Observes system signals and emits alerts within defined thresholds. Performs no remediation actions and does not modify systems."
  },
  "capabilities": [
    "read_metrics_streams",
    "detect_anomalies_within_thresholds",
    "emit_alerts_to_configured_channels",
    "generate_incident_summaries"
  ],
  "forbidden_actions": [
    "modify_system_configuration",
    "restart_services",
    "execute_remediation_playbooks",
    "access_personal_data_beyond_declared_scope"
  ],
  "autonomy": {
    "level": 2
  },
  "risk_profile": {
    "level": "medium",
    "notes": "Primary risk is false positives/negatives in alerting. No direct operational side effects are permitted."
  },
  "data_handling": {
    "stores_personal_data": false,
    "retention": "none"
  },
  "stopping_authority": {
    "stoppable_by": [
      "system_administrator",
      "oncall_manager"
    ],
    "mechanism": "Disable alerting pipeline and revoke monitoring token via admin controls. Observer continues no-ops if detached from streams.",
    "stages": [
      "pre-execution",
      "mid-execution"
    ]
  },
  "audit_surface": {
    "logging": "basic",
    "reconstructability": "partial",
    "opacity_declared": true,
    "notes": "Alert events and threshold triggers are logged. Internal anomaly scoring may be partially opaque depending on the detector implementation."
  },
  "contact": {
    "email": "reliability@example.com"
  },
  "language": {
    "primary": "en",
    "supported": [
      "en"
    ]
  }
}
